{
  "$schema": "http://json-schema.org/draft-07/schema#",
  "type": "array",
  "items": {
    "type": "object",
    "properties": {
      "playerIndex": {
        "type": "integer",
        "minimum": 0,
        "maximum": 9007199254740991
      },
      "rounds": {
        "type": "integer",
        "minimum": 0,
        "maximum": 9007199254740991
      },
      "kills": {
        "type": "integer",
        "minimum": 0,
        "maximum": 9007199254740991
      },
      "deaths": {
        "type": "integer",
        "minimum": 0,
        "maximum": 9007199254740991
      },
      "assists": {
        "type": "integer",
        "minimum": 0,
        "maximum": 9007199254740991
      },
      "damageHealth": {
        "type": "integer",
        "minimum": 0,
        "maximum": 9007199254740991
      },
      "damageArmor": {
        "type": "integer",
        "minimum": 0,
        "maximum": 9007199254740991
      },
      "adr": {
        "type": "number",
        "minimum": 0
      },
      "utilityDamage": {
        "type": "integer",
        "minimum": 0,
        "maximum": 9007199254740991
      },
      "averageUtilityDamagePerRound": {
        "type": "number",
        "minimum": 0
      },
      "headshotCount": {
        "type": "integer",
        "minimum": 0,
        "maximum": 9007199254740991
      },
      "firstKillCount": {
        "type": "integer",
        "minimum": 0,
        "maximum": 9007199254740991
      },
      "firstDeathCount": {
        "type": "integer",
        "minimum": 0,
        "maximum": 9007199254740991
      },
      "tradeKillCount": {
        "type": "integer",
        "minimum": 0,
        "maximum": 9007199254740991
      },
      "tradeDeathCount": {
        "type": "integer",
        "minimum": 0,
        "maximum": 9007199254740991
      },
      "kast": {
        "type": "number",
        "minimum": 0,
        "maximum": 100
      },
      "oneKillCount": {
        "type": "integer",
        "minimum": 0,
        "maximum": 9007199254740991
      },
      "twoKillCount": {
        "type": "integer",
        "minimum": 0,
        "maximum": 9007199254740991
      },
      "threeKillCount": {
        "type": "integer",
        "minimum": 0,
        "maximum": 9007199254740991
      },
      "fourKillCount": {
        "type": "integer",
        "minimum": 0,
        "maximum": 9007199254740991
      },
      "fiveKillCount": {
        "type": "integer",
        "minimum": 0,
        "maximum": 9007199254740991
      },
      "vsOneCount": {
        "type": "integer",
        "minimum": 0,
        "maximum": 9007199254740991
      },
      "vsOneWonCount": {
        "type": "integer",
        "minimum": 0,
        "maximum": 9007199254740991
      },
      "vsOneLostCount": {
        "type": "integer",
        "minimum": 0,
        "maximum": 9007199254740991
      },
      "vsTwoCount": {
        "type": "integer",
        "minimum": 0,
        "maximum": 9007199254740991
      },
      "vsTwoWonCount": {
        "type": "integer",
        "minimum": 0,
        "maximum": 9007199254740991
      },
      "vsTwoLostCount": {
        "type": "integer",
        "minimum": 0,
        "maximum": 9007199254740991
      },
      "vsThreeCount": {
        "type": "integer",
        "minimum": 0,
        "maximum": 9007199254740991
      },
      "vsThreeWonCount": {
        "type": "integer",
        "minimum": 0,
        "maximum": 9007199254740991
      },
      "vsThreeLostCount": {
        "type": "integer",
        "minimum": 0,
        "maximum": 9007199254740991
      },
      "vsFourCount": {
        "type": "integer",
        "minimum": 0,
        "maximum": 9007199254740991
      },
      "vsFourWonCount": {
        "type": "integer",
        "minimum": 0,
        "maximum": 9007199254740991
      },
      "vsFourLostCount": {
        "type": "integer",
        "minimum": 0,
        "maximum": 9007199254740991
      },
      "vsFiveCount": {
        "type": "integer",
        "minimum": 0,
        "maximum": 9007199254740991
      },
      "vsFiveWonCount": {
        "type": "integer",
        "minimum": 0,
        "maximum": 9007199254740991
      },
      "vsFiveLostCount": {
        "type": "integer",
        "minimum": 0,
        "maximum": 9007199254740991
      },
      "bombPlantCount": {
        "type": "integer",
        "minimum": 0,
        "maximum": 9007199254740991
      },
      "bombDefuseCount": {
        "type": "integer",
        "minimum": 0,
        "maximum": 9007199254740991
      },
      "wallbangKillCount": {
        "type": "integer",
        "minimum": 0,
        "maximum": 9007199254740991
      },
      "noScopeKillCount": {
        "type": "integer",
        "minimum": 0,
        "maximum": 9007199254740991
      },
      "collateralKillCount": {
        "type": "integer",
        "minimum": 0,
        "maximum": 9007199254740991
      },
      "kastRounds": {
        "type": "integer",
        "minimum": 0,
        "maximum": 9007199254740991
      },
      "flashAssistCount": {
        "type": "integer",
        "minimum": 0,
        "maximum": 9007199254740991
      },
      "enemyFlashDurationSeconds": {
        "type": "number",
        "minimum": 0
      },
      "teamFlashDurationSeconds": {
        "type": "number",
        "minimum": 0
      },
      "combatDeathCount": {
        "type": "integer",
        "minimum": 0,
        "maximum": 9007199254740991
      },
      "bombDeathCount": {
        "type": "integer",
        "minimum": 0,
        "maximum": 9007199254740991
      }
    },
    "required": [
      "playerIndex",
      "rounds",
      "kills",
      "deaths",
      "assists",
      "damageHealth",
      "damageArmor",
      "adr",
      "utilityDamage",
      "averageUtilityDamagePerRound",
      "headshotCount",
      "firstKillCount",
      "firstDeathCount",
      "tradeKillCount",
      "tradeDeathCount",
      "kast",
      "oneKillCount",
      "twoKillCount",
      "threeKillCount",
      "fourKillCount",
      "fiveKillCount",
      "vsOneCount",
      "vsOneWonCount",
      "vsOneLostCount",
      "vsTwoCount",
      "vsTwoWonCount",
      "vsTwoLostCount",
      "vsThreeCount",
      "vsThreeWonCount",
      "vsThreeLostCount",
      "vsFourCount",
      "vsFourWonCount",
      "vsFourLostCount",
      "vsFiveCount",
      "vsFiveWonCount",
      "vsFiveLostCount",
      "bombPlantCount",
      "bombDefuseCount",
      "wallbangKillCount",
      "noScopeKillCount",
      "collateralKillCount",
      "kastRounds",
      "flashAssistCount",
      "enemyFlashDurationSeconds",
      "teamFlashDurationSeconds",
      "combatDeathCount",
      "bombDeathCount"
    ],
    "additionalProperties": false
  }
}
