[{"playerIndex":0,"rounds":21,"kills":13,"deaths":12,"assists":4,"damageHealth":1485,"damageArmor":141,"utilityDamage":0,"headshotCount":6,"firstKillCount":0,"firstDeathCount":1,"tradeKillCount":2,"tradeDeathCount":4,"noScopeKillCount":0,"wallbangKillCount":1,"collateralKillCount":0,"bombPlantCount":1,"bombDefuseCount":0,"oneKillCount":6,"twoKillCount":2,"threeKillCount":1,"fourKillCount":0,"fiveKillCount":0,"vsOneCount":0,"vsOneWonCount":0,"vsOneLostCount":0,"vsTwoCount":1,"vsTwoWonCount":1,"vsTwoLostCount":0,"vsThreeCount":0,"vsThreeWonCount":0,"vsThreeLostCount":0,"vsFourCount":2,"vsFourWonCount":0,"vsFourLostCount":2,"vsFiveCount":0,"vsFiveWonCount":0,"vsFiveLostCount":0,"kastRounds":18,"flashAssistCount":0,"enemyFlashDurationSeconds":8.111,"teamFlashDurationSeconds":12.494,"combatDeathCount":12,"bombDeathCount":0,"adr":70.71,"kast":85.714,"averageUtilityDamagePerRound":0.0},{"playerIndex":1,"rounds":21,"kills":13,"deaths":13,"assists":9,"damageHealth":1704,"damageArmor":328,"utilityDamage":237,"headshotCount":7,"firstKillCount":4,"firstDeathCount":3,"tradeKillCount":2,"tradeDeathCount":4,"noScopeKillCount":0,"wallbangKillCount":0,"collateralKillCount":0,"bombPlantCount":0,"bombDefuseCount":0,"oneKillCount":4,"twoKillCount":3,"threeKillCount":1,"fourKillCount":0,"fiveKillCount":0,"vsOneCount":0,"vsOneWonCount":0,"vsOneLostCount":0,"vsTwoCount":1,"vsTwoWonCount":0,"vsTwoLostCount":1,"vsThreeCount":0,"vsThreeWonCount":0,"vsThreeLostCount":0,"vsFourCount":0,"vsFourWonCount":0,"vsFourLostCount":0,"vsFiveCount":0,"vsFiveWonCount":0,"vsFiveLostCount":0,"kastRounds":16,"flashAssistCount":2,"enemyFlashDurationSeconds":27.415,"teamFlashDurationSeconds":16.303,"combatDeathCount":13,"bombDeathCount":0,"adr":81.14,"kast":76.19,"averageUtilityDamagePerRound":11.29},{"playerIndex":2,"rounds":21,"kills":25,"deaths":11,"assists":4,"damageHealth":2254,"damageArmor":284,"utilityDamage":104,"headshotCount":12,"firstKillCount":3,"firstDeathCount":4,"tradeKillCount":7,"tradeDeathCount":0,"noScopeKillCount":0,"wallbangKillCount":1,"collateralKillCount":0,"bombPlantCount":2,"bombDefuseCount":0,"oneKillCount":9,"twoKillCount":5,"threeKillCount":2,"fourKillCount":0,"fiveKillCount":0,"vsOneCount":0,"vsOneWonCount":0,"vsOneLostCount":0,"vsTwoCount":2,"vsTwoWonCount":1,"vsTwoLostCount":1,"vsThreeCount":0,"vsThreeWonCount":0,"vsThreeLostCount":0,"vsFourCount":0,"vsFourWonCount":0,"vsFourLostCount":0,"vsFiveCount":0,"vsFiveWonCount":0,"vsFiveLostCount":0,"kastRounds":16,"flashAssistCount":0,"enemyFlashDurationSeconds":0.0,"teamFlashDurationSeconds":0.0,"combatDeathCount":11,"bombDeathCount":0,"adr":107.33,"kast":76.19,"averageUtilityDamagePerRound":4.95},{"playerIndex":3,"rounds":21,"kills":13,"deaths":16,"assists":5,"damageHealth":1372,"damageArmor":228,"utilityDamage":0,"headshotCount":8,"firstKillCount":1,"firstDeathCount":3,"tradeKillCount":2,"tradeDeathCount":4,"noScopeKillCount":0,"wallbangKillCount":0,"collateralKillCount":0,"bombPlantCount":3,"bombDefuseCount":0,"oneKillCount":5,"twoKillCount":4,"threeKillCount":0,"fourKillCount":0,"fiveKillCount":0,"vsOneCount":0,"vsOneWonCount":0,"vsOneLostCount":0,"vsTwoCount":0,"vsTwoWonCount":0,"vsTwoLostCount":0,"vsThreeCount":0,"vsThreeWonCount":0,"vsThreeLostCount":0,"vsFourCount":0,"vsFourWonCount":0,"vsFourLostCount":0,"vsFiveCount":1,"vsFiveWonCount":0,"vsFiveLostCount":1,"kastRounds":16,"flashAssistCount":0,"enemyFlashDurationSeconds":9.086,"teamFlashDurationSeconds":19.119,"combatDeathCount":16,"bombDeathCount":0,"adr":65.33,"kast":76.19,"averageUtilityDamagePerRound":0.0},{"playerIndex":4,"rounds":21,"kills":20,"deaths":14,"assists":6,"damageHealth":2004,"damageArmor":285,"utilityDamage":60,"headshotCount":6,"firstKillCount":1,"firstDeathCount":1,"tradeKillCount":4,"tradeDeathCount":5,"noScopeKillCount":0,"wallbangKillCount":0,"collateralKillCount":0,"bombPlantCount":1,"bombDefuseCount":1,"oneKillCount":8,"twoKillCount":3,"threeKillCount":2,"fourKillCount":0,"fiveKillCount":0,"vsOneCount":0,"vsOneWonCount":0,"vsOneLostCount":0,"vsTwoCount":0,"vsTwoWonCount":0,"vsTwoLostCount":0,"vsThreeCount":3,"vsThreeWonCount":0,"vsThreeLostCount":3,"vsFourCount":0,"vsFourWonCount":0,"vsFourLostCount":0,"vsFiveCount":0,"vsFiveWonCount":0,"vsFiveLostCount":0,"kastRounds":18,"flashAssistCount":0,"enemyFlashDurationSeconds":12.992,"teamFlashDurationSeconds":16.865,"combatDeathCount":14,"bombDeathCount":0,"adr":95.43,"kast":85.714,"averageUtilityDamagePerRound":2.86},{"playerIndex":5,"rounds":21,"kills":14,"deaths":16,"assists":4,"damageHealth":1801,"damageArmor":334,"utilityDamage":110,"headshotCount":10,"firstKillCount":6,"firstDeathCount":3,"tradeKillCount":1,"tradeDeathCount":4,"noScopeKillCount":0,"wallbangKillCount":0,"collateralKillCount":0,"bombPlantCount":0,"bombDefuseCount":1,"oneKillCount":6,"twoKillCount":4,"threeKillCount":0,"fourKillCount":0,"fiveKillCount":0,"vsOneCount":0,"vsOneWonCount":0,"vsOneLostCount":0,"vsTwoCount":0,"vsTwoWonCount":0,"vsTwoLostCount":0,"vsThreeCount":0,"vsThreeWonCount":0,"vsThreeLostCount":0,"vsFourCount":0,"vsFourWonCount":0,"vsFourLostCount":0,"vsFiveCount":0,"vsFiveWonCount":0,"vsFiveLostCount":0,"kastRounds":12,"flashAssistCount":0,"enemyFlashDurationSeconds":14.168,"teamFlashDurationSeconds":26.909,"combatDeathCount":16,"bombDeathCount":0,"adr":85.76,"kast":57.143,"averageUtilityDamagePerRound":5.24},{"playerIndex":6,"rounds":21,"kills":15,"deaths":18,"assists":3,"damageHealth":935,"damageArmor":118,"utilityDamage":3,"headshotCount":6,"firstKillCount":3,"firstDeathCount":4,"tradeKillCount":6,"tradeDeathCount":4,"noScopeKillCount":0,"wallbangKillCount":0,"collateralKillCount":0,"bombPlantCount":0,"bombDefuseCount":0,"oneKillCount":8,"twoKillCount":2,"threeKillCount":1,"fourKillCount":0,"fiveKillCount":0,"vsOneCount":0,"vsOneWonCount":0,"vsOneLostCount":0,"vsTwoCount":1,"vsTwoWonCount":0,"vsTwoLostCount":1,"vsThreeCount":1,"vsThreeWonCount":0,"vsThreeLostCount":1,"vsFourCount":2,"vsFourWonCount":0,"vsFourLostCount":2,"vsFiveCount":0,"vsFiveWonCount":0,"vsFiveLostCount":0,"kastRounds":14,"flashAssistCount":0,"enemyFlashDurationSeconds":18.704,"teamFlashDurationSeconds":0.748,"combatDeathCount":18,"bombDeathCount":0,"adr":44.52,"kast":66.667,"averageUtilityDamagePerRound":0.14},{"playerIndex":7,"rounds":21,"kills":8,"deaths":19,"assists":9,"damageHealth":1218,"damageArmor":258,"utilityDamage":26,"headshotCount":3,"firstKillCount":1,"firstDeathCount":2,"tradeKillCount":1,"tradeDeathCount":7,"noScopeKillCount":0,"wallbangKillCount":0,"collateralKillCount":0,"bombPlantCount":2,"bombDefuseCount":1,"oneKillCount":5,"twoKillCount":0,"threeKillCount":1,"fourKillCount":0,"fiveKillCount":0,"vsOneCount":0,"vsOneWonCount":0,"vsOneLostCount":0,"vsTwoCount":0,"vsTwoWonCount":0,"vsTwoLostCount":0,"vsThreeCount":0,"vsThreeWonCount":0,"vsThreeLostCount":0,"vsFourCount":1,"vsFourWonCount":0,"vsFourLostCount":1,"vsFiveCount":0,"vsFiveWonCount":0,"vsFiveLostCount":0,"kastRounds":15,"flashAssistCount":0,"enemyFlashDurationSeconds":0.0,"teamFlashDurationSeconds":4.419,"combatDeathCount":19,"bombDeathCount":0,"adr":58.0,"kast":71.429,"averageUtilityDamagePerRound":1.24},{"playerIndex":8,"rounds":21,"kills":15,"deaths":18,"assists":9,"damageHealth":2223,"damageArmor":384,"utilityDamage":21,"headshotCount":7,"firstKillCount":2,"firstDeathCount":0,"tradeKillCount":6,"tradeDeathCount":5,"noScopeKillCount":0,"wallbangKillCount":0,"collateralKillCount":0,"bombPlantCount":0,"bombDefuseCount":0,"oneKillCount":9,"twoKillCount":3,"threeKillCount":0,"fourKillCount":0,"fiveKillCount":0,"vsOneCount":1,"vsOneWonCount":0,"vsOneLostCount":1,"vsTwoCount":1,"vsTwoWonCount":0,"vsTwoLostCount":1,"vsThreeCount":0,"vsThreeWonCount":0,"vsThreeLostCount":0,"vsFourCount":1,"vsFourWonCount":0,"vsFourLostCount":1,"vsFiveCount":0,"vsFiveWonCount":0,"vsFiveLostCount":0,"kastRounds":17,"flashAssistCount":0,"enemyFlashDurationSeconds":7.531,"teamFlashDurationSeconds":0.755,"combatDeathCount":18,"bombDeathCount":0,"adr":105.86,"kast":80.952,"averageUtilityDamagePerRound":1.0},{"playerIndex":9,"rounds":21,"kills":14,"deaths":13,"assists":0,"damageHealth":1331,"damageArmor":241,"utilityDamage":0,"headshotCount":8,"firstKillCount":0,"firstDeathCount":0,"tradeKillCount":6,"tradeDeathCount":0,"noScopeKillCount":0,"wallbangKillCount":0,"collateralKillCount":0,"bombPlantCount":0,"bombDefuseCount":1,"oneKillCount":4,"twoKillCount":3,"threeKillCount":0,"fourKillCount":1,"fiveKillCount":0,"vsOneCount":1,"vsOneWonCount":0,"vsOneLostCount":1,"vsTwoCount":0,"vsTwoWonCount":0,"vsTwoLostCount":0,"vsThreeCount":1,"vsThreeWonCount":0,"vsThreeLostCount":1,"vsFourCount":1,"vsFourWonCount":0,"vsFourLostCount":1,"vsFiveCount":2,"vsFiveWonCount":0,"vsFiveLostCount":2,"kastRounds":11,"flashAssistCount":0,"enemyFlashDurationSeconds":22.156,"teamFlashDurationSeconds":22.687,"combatDeathCount":13,"bombDeathCount":0,"adr":63.38,"kast":52.381,"averageUtilityDamagePerRound":0.0}]